{
  "candidate_id": "standalone-runtime-example",
  "candidate_name": "Standalone Runtime Example",
  "registry_date": "2026-03-23",
  "linked_promotion_record": "runtime/07-promotion-records/2026-03-23-standalone-runtime-example-promotion-record.md",
  "host": "directive-workspace-standalone-host",
  "runtime_surface": "bounded local runtime artifact lifecycle",
  "runtime_status": "reference_live",
  "verification": "claimed",
  "proof_path": "runtime/03-proof/2026-03-23-standalone-runtime-example-proof-checklist.md",
  "last_validated_by": "check:directive-standalone-runtime-host",
  "last_validation_date": "2026-03-23",
  "active_risks": [
    "local reference lane only",
    "not a broad multi-host runtime surface"
  ],
  "rollback_path": "Delete the generated registry entry and revert the local Runtime lifecycle artifacts.",
  "notes": [
    "This example is for bounded local/shareable usage.",
    "Generate the proof bundle before using this for real promotion history."
  ]
}
